{
  "source": "NOAA Physical Sciences Laboratory (PSL)",
  "url": "https://psl.noaa.gov/eddi/#timeseries",
  "download_date": "2026-09-06",
  "subset_description": "EDDI 3-month and monthly reference ET from the NOAA PSL EDDI time-series master table for latitude 39.75 to 39.875 and longitude -105.0 to -104.875.",
  "checksum_sha256": "9440d6671865eb72df7912424928124c3cdd4ab9fe2ad1c67206a9a4f727415c",
  "fixture_version": "1.0.0",
  "validation_tolerance": {
    "rtol": 1e-05,
    "atol": 1e-05
  },
  "citation": "Hobbins, M. T., A. Wood, D. McEvoy, J. Huntington, C. Morton, M. Anderson, and C. Hain (2016), The Evaporative Demand Drought Index. Part I.",
  "doi": "10.1175/JHM-D-15-0121.1",
  "license": "Public domain (U.S. Government work)",
  "notes": "Retrieved through the NOAA PSL time-series tool using monavg=1 and monend=0; the table baseline is 1979-2023."
}
