{
  "source": "xclim 0.62.0 and windpowerlib 0.2.2, synthetic inputs",
  "url": "https://github.com/Ouranosinc/xclim/tree/v0.62.0",
  "download_date": "2026-10-17",
  "subset_description": "Nine power/log wind-profile cases; speeds 0, 1, 3.5, 12 m s-1 and missing; heights 10-150 m.",
  "checksum_sha256": "8b8164b59ed774ec7e949fb98746029658b9d649d019d2602035f6993a67f39e",
  "fixture_version": "1.0.0",
  "validation_tolerance": {
    "rtol": 0.0,
    "atol": 1e-12
  },
  "citation": "xclim.indices.wind_profile (power_law); windpowerlib.wind_speed.logarithmic_profile (obstacle_height=0), https://github.com/wind-python/windpowerlib/tree/v0.2.2.",
  "license": "Synthetic inputs and generated numerical outputs; reference software: xclim Apache-2.0, windpowerlib MIT. No implementation source copied.",
  "notes": "Generated offline by scripts/prepare_energy_wind_fixtures.py. reference.json records source commits, verified full source-file SHA-256 hashes and numerical dependency versions. Heights and roughness are metres; output is m s-1. Independent-implementation comparisons, not observed-wind validation. atol=1e-12 permits double-precision cross-platform arithmetic only; calm, identity and NaN masks are exact. tests/test_energy_reference.py compares climate_indices with these synthetic profile outputs. Two-level log-ratio recovery is consistency evidence only, not an independent oracle. Maintainer confirmation of generation/redistribution is required in the fixture PR."
}
