{
  "source": "R SEI and SCI packages",
  "url": "https://cran.r-project.org/package=SEI (https://cran.r-project.org/package=SCI)",
  "download_date": "2026-09-29",
  "subset_description": "Deterministic 100-year zero-heavy monthly precipitation series and the R SEI (0.2.0) and SCI (1.0-3) gamma standardized-index reference for the ADR-0015 zero-placement modes.",
  "checksum_sha256": "3185273f3b2e71fb2588630dcc01dcdb97e3912d39464faee2d5fa4c5ea559df",
  "fixture_version": "1.0.0",
  "validation_tolerance": {
    "zero_constant_atol": 1e-12,
    "parameter_matched_atol": 1e-06,
    "end_to_end_atol": 0.01,
    "sci_center_of_mass_atol": 0.2
  },
  "citation": "Allen, S. & Otero, N. (2024). Calculating Standardised Indices Using SEI. The R Journal 16(4), 102-122. https://doi.org/10.32614/RJ-2024-038; Gudmundsson, L. & Stagge, J. H. (2014). SCI: Standardized Climate Indices. https://cran.r-project.org/package=SCI",
  "doi": "10.32614/RJ-2024-038",
  "license": "R packages under their CRAN licenses (GPL-3)",
  "notes": "Generated by scripts/prepare_zero_handling_fixtures.py via scripts/zero_handling_reference.R. R 4.6.1, SEI 0.2.0, SCI 1.0.3. SEI fits gamma by MLE (fitdistrplus) while climate_indices uses Thom's method-of-moments approximation, so the full series is compared against SEI's fitted shape/rate; only the zero-placement constants are exact. Month 6 is all zeros: SEI's censored modes still assign their constant while climate_indices treats the undefined mass as classic (ADR-0015 decision 5); SEI's classic mode gives +Inf there. SCI estimates p0 with the Weibull plotting position np/(n+1) and places zeros at (np+1)/(2(n+1)), so its centre-of-mass constant differs from climate_indices' np/(2n). The gap is at most 0.16 in z for this fixture (smallest non-degenerate p0 is 0.02) and grows for sparser steps; the sci_center_of_mass_atol records it."
}
