{
  "source": "NOAA NCEI GHCN-Daily, station USW00093193 (Fresno Yosemite International Airport, California)",
  "url": "https://www.ncei.noaa.gov/access/services/data/v1?dataset=daily-summaries&stations=USW00093193&startDate=1991-01-01&endDate=2020-12-31&dataTypes=PRCP,TMAX&format=csv&includeAttributes=false",
  "download_date": "2026-09-15",
  "subset_description": "Complete daily PRCP and TMAX for 1991-01-01 through 2020-12-31 (10958 days, no missing values). The expected kbdi_mm column was generated by the independent plain-Python calculator in scripts/prepare_kbdi_fixtures.py, starting from zero and deriving mean annual precipitation from the record (278.900607 mm/year).",
  "checksum_sha256": "292b08843dc02ee34c4784c49f5ac215a7ac4feca45e3253af3bab94666b7b79",
  "fixture_version": "1.0.0",
  "validation_tolerance": {
    "regression_rtol": 1e-12,
    "regression_atol_mm": 1e-09
  },
  "citation": "Menne, M.J., Durre, I., Vose, R.S., Gleason, B.E. and Houston, T.G. (2012) An Overview of the Global Historical Climatology Network-Daily Database. Journal of Atmospheric and Oceanic Technology 29(7):897-910. https://doi.org/10.1175/JTECH-D-11-00103.1",
  "license": "Public domain (U.S. Government work, 17 USC 105).",
  "notes": "Regression coverage, not independent scientific validation: the expected values share the project's platform decisions (metric evaluation, zero initialization, contiguous daily observations) and differ from a production run only in summation order. Raw access-service download SHA-256: 5a235c4c839cb1345072637db9e9071359dcc10f0c24d0ec0d3e37f9fbf1cf01. The station window was selected as the longest complete run in the station's 1980-2024 record; 1991-2020 aligns with the current U.S. Climate Normals period and meets the library's 30-year derivation minimum."
}
