{
  "source": "R SPEI package (CRAN)",
  "url": "https://cran.r-project.org/package=SPEI",
  "download_date": "2026-09-29",
  "subset_description": "Standardized log-logistic SPEI from the R SPEI package for three CONUS climate divisions (nClimDiv precip/temps, Thornthwaite PET, 1901-2022) at timescales 1/3/6/12, plus a short highly skewed synthetic series at timescales 1/6.",
  "checksum_sha256": "5d5ce6278861c11dd33caef9d567abbda27288b53940491ef0714000063c2fab",
  "fixture_version": "1.0.0",
  "validation_tolerance": {
    "series_atol": 1e-06,
    "parameter_atol": 1e-06,
    "parameter_rtol": 1e-08
  },
  "citation": "Vicente-Serrano, S. M., Beguer\u00eda, S. & L\u00f3pez-Moreno, J. I. (2010). J. Climate 23, 1696-1718; Beguer\u00eda, S., et al. (2014). Int. J. Climatol. 34, 3001-3023; https://cran.r-project.org/package=SPEI",
  "doi": "10.1175/2009JCLI2909.1",
  "license": "R packages under their CRAN licenses (GPL-3)",
  "notes": "Generated by scripts/prepare_spei_loglogistic_fixtures.py via scripts/spei_loglogistic_reference.R. R 4.6.1, SPEI 1.8.1, TLMoments 0.7.5.3, lmom 3.3. SPEI fits each calendar step with unbiased-PWM L-moments (TLMoments::PWM + lmom::pelglo), the estimator lmoments.fit_glo implements, so the fitted parameters and the standardized series agree to machine precision (series ~1e-12, parameters <=~1e-10); the recorded tolerances absorb only cross-platform numerical wobble. The R input is the (P - PET) + 1000 water balance indices.spei builds internally, so both sides fit the identical scaled series; the offset cancels in the standardized values. SPEI does not clip to the [-3.09, 3.09] range this library enforces, so the comparison covers finite values inside that range and asserts this library's clip on the out-of-range tail separately. The synthetic series has a constant calendar month that is unfittable at scale 1 (both implementations report it missing: SPEI as NA, this library as a zeroed scale -> NaN); at scale 6 the constant month enters non-constant multi-month sums and is fittable."
}
